{
  "case": "tool_batch_closed",
  "cbor_hex": "a171746f6f6c5f62617463685f636c6f736564a7656379636c6500676f7574636f6d656866696e616c697a65677475726e5f6964782430313233343536372d383961622d376364652d383961622d3031323334353637383934356c636c6f73655f6469676573747840343434343434343434343434343434343434343434343434343434343434343434343434343434343434343434343434343434343434343434343434343434346d746f6f6c5f62617463685f6964782430313233343536372d383961622d376364652d383961622d30313233343536373839343671736f757263655f6d6573736167655f6964782430313233343536372d383961622d376364652d383961622d30313233343536373839343772726573756c745f6d6573736167655f69647381782430313233343536372d383961622d376364652d383961622d303132333435363738393438",
  "diagnostic_json": {
    "tool_batch_closed": {
      "close_digest": "4444444444444444444444444444444444444444444444444444444444444444",
      "cycle": 0,
      "outcome": "finalize",
      "result_message_ids": [
        "01234567-89ab-7cde-89ab-012345678948"
      ],
      "source_message_id": "01234567-89ab-7cde-89ab-012345678947",
      "tool_batch_id": "01234567-89ab-7cde-89ab-012345678946",
      "turn_id": "01234567-89ab-7cde-89ab-012345678945"
    }
  },
  "expect": {
    "ok": true
  },
  "format_version": 1,
  "payload_digest": "91c1d784adadd9025109b147c63838f490755dc0b165cd49580963eeb16bffc8",
  "subject": "record-payload"
}
