{
  "case": "budget_reservation_released",
  "cbor_hex": "a1781b6275646765745f7265736572766174696f6e5f72656c6561736564a16772656365697074a66873636f70655f6964782430303030303030302d303030302d373030302d383030302d3030303030303030303063386e726563656970745f6469676573747840666663616230376665356431363162303663623762316266636532353137633635326635336165346234383232623863303164323531313662363234383363656e726571756573745f6469676573747840386663376639613737373765366336353731623932336137653737363333343238613935323930613362376532616531373033383861363361346137616564306e7265736572766174696f6e5f6964782430303030303030302d303030302d373030302d383030302d3030303030303030303063396f72656c65617365645f756e75736564a06f7465726d696e616c5f72756e5f6964782430303030303030302d303030302d373030302d383030302d303030303030303030303033",
  "diagnostic_json": {
    "budget_reservation_released": {
      "receipt": {
        "receipt_digest": "ffcab07fe5d161b06cb7b1bfce2517c652f53ae4b4822b8c01d25116b62483ce",
        "released_unused": {},
        "request_digest": "8fc7f9a7777e6c6571b923a7e77633428a95290a3b7e2ae170388a63a4a7aed0",
        "reservation_id": "00000000-0000-7000-8000-0000000000c9",
        "scope_id": "00000000-0000-7000-8000-0000000000c8",
        "terminal_run_id": "00000000-0000-7000-8000-000000000003"
      }
    }
  },
  "expect": {
    "ok": true
  },
  "format_version": 1,
  "payload_digest": "4793d238f69275ebed05bf7953fc95dcfcfc6f5ccb8f8a35d792f4d1a68647b4",
  "subject": "record-payload"
}
