{
  "case": "effect_deferred",
  "cbor_hex": "a16f6566666563745f6465666572726564a46668616e646c65a36668616e646c656268316870726f76696465727666696e737461636b2e70726f76696465722e64656d6f777265636f6e63696c696174696f6e5f6d65746164617461427b7d696566666563745f6964782430303030303030302d303030302d373030302d383030302d3030303030303030303030626e7265636f6e63696c696174696f6e64706f6c6c6f6f75747075745f636f6e7472616374a3646b696e646e6d6f64656c5f726573706f6e73656d736368656d615f6469676573747840666663616230376665356431363162303663623762316266636532353137633635326635336165346234383232623863303164323531313662363234383363656e736368656d615f76657273696f6e01",
  "diagnostic_json": {
    "effect_deferred": {
      "effect_id": "00000000-0000-7000-8000-00000000000b",
      "handle": {
        "handle": "h1",
        "provider": "finstack.provider.demo",
        "reconciliation_metadata": {}
      },
      "output_contract": {
        "kind": "model_response",
        "schema_digest": "ffcab07fe5d161b06cb7b1bfce2517c652f53ae4b4822b8c01d25116b62483ce",
        "schema_version": 1
      },
      "reconciliation": "poll"
    }
  },
  "expect": {
    "ok": true
  },
  "format_version": 1,
  "payload_digest": "d4b23fb992159f5a9e7e4dd9bb9686de97b027d37689f67f20c07a90c02361e9",
  "subject": "record-payload"
}
