{
  "case": "final_result_recorded",
  "cbor_hex": "a17566696e616c5f726573756c745f7265636f72646564ab656379636c65006576616c75654d7b22616e73776572223a34327d66736368656d61a36564726166746b64726166743230323031326d736368656d615f6469676573747840323232323232323232323232323232323232323232323232323232323232323232323232323232323232323232323232323232323232323232323232323232326e736368656d615f76657273696f6e0166736f75726365a16a6a736f6e5f626c6f636ba16d636f6e74656e745f696e64657800677475726e5f6964782430313233343536372d383961622d376364652d383961622d303132333435363739313135696566666563745f6964782430313233343536372d383961622d376364652d383961622d3031323334353637393131376a6d6573736167655f6964782430313233343536372d383961622d376364652d383961622d3031323334353637393131386c656e645f7374726174656779656561726c796c76616c75655f646967657374784034393739636561356437333632396161373065303630643366663037336637653864613364666162353461333132353661343236353139333165386636313163706d6f64656c5f726571756573745f6964782430313233343536372d383961622d376364652d383961622d30313233343536373931313675736b69707065645f746f6f6c5f63616c6c5f69647380",
  "diagnostic_json": {
    "final_result_recorded": {
      "cycle": 0,
      "effect_id": "01234567-89ab-7cde-89ab-012345679117",
      "end_strategy": "early",
      "message_id": "01234567-89ab-7cde-89ab-012345679118",
      "model_request_id": "01234567-89ab-7cde-89ab-012345679116",
      "schema": {
        "draft": "draft202012",
        "schema_digest": "2222222222222222222222222222222222222222222222222222222222222222",
        "schema_version": 1
      },
      "skipped_tool_call_ids": [],
      "source": {
        "json_block": {
          "content_index": 0
        }
      },
      "turn_id": "01234567-89ab-7cde-89ab-012345679115",
      "value": {
        "answer": 42
      },
      "value_digest": "4979cea5d73629aa70e060d3ff073f7e8da3dfab54a31256a42651931e8f611c"
    }
  },
  "expect": {
    "ok": true
  },
  "format_version": 1,
  "payload_digest": "489d084f17633b11396d08966440c60817323901ba10a95a36fc6920d0e8e597",
  "subject": "record-payload"
}
