{
  "case": "conversation_entry",
  "cbor_hex": "a172636f6e766572736174696f6e5f656e747279a4626964782430303030303030302d303030302d373030302d383030302d30303030303030303030356164626f6479a1676d657373616765a6626964782430303030303030302d303030302d373030302d383030302d30303030303030303030356164726f6c65647573657267636f6e74656e7481a2646b696e64647465787464746578746568656c6c6f686d65746164617461427b7d6a637265617465645f6174006c70726f76696465725f696473a0676c616e655f6964782430303030303030302d303030302d373030302d383030302d3030303030303030303030326873657175656e636501",
  "diagnostic_json": {
    "conversation_entry": {
      "body": {
        "message": {
          "content": [
            {
              "kind": "text",
              "text": "hello"
            }
          ],
          "created_at": "1970-01-01T00:00:00.000Z",
          "id": "00000000-0000-7000-8000-00000000005a",
          "metadata": {},
          "provider_ids": {},
          "role": "user"
        }
      },
      "id": "00000000-0000-7000-8000-00000000005a",
      "lane_id": "00000000-0000-7000-8000-000000000002",
      "sequence": 1
    }
  },
  "expect": {
    "ok": true
  },
  "format_version": 1,
  "payload_digest": "8d87ddc216fc0ebb0186c1db6a9359cbbffdc4df8c0271451c420c3cda089740",
  "subject": "record-payload"
}
