{
  "case": "cancellation_requested",
  "cbor_hex": "ac64626f6479a17663616e63656c6c6174696f6e5f726571756573746564a16772657175657374a269696e69746961746f7268646561646c696e656a726571756573745f6964782430303030303030302d303030302d373030302d383030302d3030303030303030303033326672756e5f6964782430303030303030302d303030302d373030302d383030302d303030303030303030303033676c616e655f6964782430303030303030302d303030302d373030302d383030302d30303030303030303030303268636865636b73756d7840353236393365383531303263626661363731633030353766373237373262616632333463363833306534333763633661316163653737346233323033383465376873657175656e636506697265636f72645f6964782430303030303030302d303030302d373030302d383030302d3030303030303030303036616974696d657374616d70006a73657373696f6e5f6964782430303030303030302d303030302d373030302d383030302d3030303030303030303030316c6b696e645f76657273696f6e016e666f726d61745f76657273696f6e016e7061796c6f61645f64696765737478406264366461386163306364333436336238383135623039316533666264333131663439306333633638396430313635353237356637346333323564373336333971646572697665645f6576656e745f69647380",
  "checksum": "52693e85102cbfa671c0057f72772baf234c6830e437cc6a1ace774b320384e7",
  "diagnostic_json": {
    "body": {
      "cancellation_requested": {
        "request": {
          "initiator": "deadline",
          "request_id": "00000000-0000-7000-8000-000000000032"
        }
      }
    },
    "checksum": "52693e85102cbfa671c0057f72772baf234c6830e437cc6a1ace774b320384e7",
    "derived_event_ids": [],
    "format_version": 1,
    "kind_version": 1,
    "lane_id": "00000000-0000-7000-8000-000000000002",
    "payload_digest": "bd6da8ac0cd3463b8815b091e3fbd311f490c3c689d01655275f74c325d73639",
    "record_id": "00000000-0000-7000-8000-00000000006a",
    "run_id": "00000000-0000-7000-8000-000000000003",
    "sequence": 6,
    "session_id": "00000000-0000-7000-8000-000000000001",
    "timestamp": "1970-01-01T00:00:00.000Z"
  },
  "expect": {
    "ok": true
  },
  "format_version": 1,
  "payload_digest": "bd6da8ac0cd3463b8815b091e3fbd311f490c3c689d01655275f74c325d73639",
  "subject": "envelope"
}
