{
  "case": "session_created",
  "cbor_hex": "ab64626f6479a16f73657373696f6e5f63726561746564a1686d65746164617461427b7d676c616e655f6964782430303030303030302d303030302d373030302d383030302d30303030303030303030303268636865636b73756d7840326231623834646630363830366532393332373630623463306261353331643266383764636261316266623933353630326634396633373231313838663133386873657175656e63651821697265636f72645f6964782430303030303030302d303030302d373030302d383030302d3030303030303030303038356974696d657374616d70006a73657373696f6e5f6964782430303030303030302d303030302d373030302d383030302d3030303030303030303030316c6b696e645f76657273696f6e016e666f726d61745f76657273696f6e016e7061796c6f61645f64696765737478406438333962396236643465323336623431653432646238313163366339343463396365643361323239343739613333663739363332306139323432376130343171646572697665645f6576656e745f69647380",
  "checksum": "2b1b84df06806e2932760b4c0ba531d2f87dcba1bfb935602f49f3721188f138",
  "diagnostic_json": {
    "body": {
      "session_created": {
        "metadata": {}
      }
    },
    "checksum": "2b1b84df06806e2932760b4c0ba531d2f87dcba1bfb935602f49f3721188f138",
    "derived_event_ids": [],
    "format_version": 1,
    "kind_version": 1,
    "lane_id": "00000000-0000-7000-8000-000000000002",
    "payload_digest": "d839b9b6d4e236b41e42db811c6c944c9ced3a229479a33f796320a92427a041",
    "record_id": "00000000-0000-7000-8000-000000000085",
    "sequence": 33,
    "session_id": "00000000-0000-7000-8000-000000000001",
    "timestamp": "1970-01-01T00:00:00.000Z"
  },
  "expect": {
    "ok": true
  },
  "format_version": 1,
  "payload_digest": "d839b9b6d4e236b41e42db811c6c944c9ced3a229479a33f796320a92427a041",
  "subject": "envelope"
}
