{
  "case": "interaction_requested",
  "cbor_hex": "ac64626f6479a175696e746572616374696f6e5f726571756573746564ac646b696e64a1646b696e6468617070726f76616c6670726f6d707480686d65746164617461427b7d696566666563745f6964782430303030303030302d303030302d373030302d383030302d3030303030303030303031356b64656c6567617461626c65f46d70726f6d70745f6469676573747840363130356131323439353832386165343132383161306466613834373733356165643532393838333630333463393331383232343439363432316461396663316e696e746572616374696f6e5f6964782430303030303030302d303030302d373030302d383030302d3030303030303030303031346e706f6c6963795f76657273696f6ea3656d616a6f7201656d696e6f7200657061746368006f726571756573745f76657273696f6e016f726573706f6e73655f736368656d61527b2274797065223a22626f6f6c65616e227d70706f6c6963795f636f6d706f6e656e74a2626964781866696e737461636b2e706f6c6963792e617070726f76616c6776657273696f6ea3656d616a6f7201656d696e6f72006570617463680076726573706f6e73655f736368656d615f6469676573747840343931346430643661326633366433373166613265323534613737366530643036393336376437383335373630373333393863353261356134336562323539666672756e5f6964782430303030303030302d303030302d373030302d383030302d303030303030303030303033676c616e655f6964782430303030303030302d303030302d373030302d383030302d30303030303030303030303268636865636b73756d7840343330303630333036303664353561333434666364623164663033663238663232633338626130636637646238643837333965323839376536386132653561306873657175656e636514697265636f72645f6964782430303030303030302d303030302d373030302d383030302d3030303030303030303037386974696d657374616d70006a73657373696f6e5f6964782430303030303030302d303030302d373030302d383030302d3030303030303030303030316c6b696e645f76657273696f6e016e666f726d61745f76657273696f6e016e7061796c6f61645f64696765737478403736393837333665323338626266363034623139323131663537663231633633633535303333353461643962346566333165373534623661396339363966303971646572697665645f6576656e745f69647381782430303030303030302d303030302d373030302d383030302d303030303030303030343463",
  "checksum": "43006030606d55a344fcdb1df03f28f22c38ba0cf7db8d8739e2897e68a2e5a0",
  "diagnostic_json": {
    "body": {
      "interaction_requested": {
        "delegatable": false,
        "effect_id": "00000000-0000-7000-8000-000000000015",
        "interaction_id": "00000000-0000-7000-8000-000000000014",
        "kind": {
          "kind": "approval"
        },
        "metadata": {},
        "policy_component": {
          "id": "finstack.policy.approval",
          "version": {
            "major": 1,
            "minor": 0,
            "patch": 0
          }
        },
        "policy_version": {
          "major": 1,
          "minor": 0,
          "patch": 0
        },
        "prompt": [],
        "prompt_digest": "6105a12495828ae41281a0dfa847735aed5298836034c9318224496421da9fc1",
        "request_version": 1,
        "response_schema": {
          "type": "boolean"
        },
        "response_schema_digest": "4914d0d6a2f36d371fa2e254a776e0d069367d783576073398c52a5a43eb259f"
      }
    },
    "checksum": "43006030606d55a344fcdb1df03f28f22c38ba0cf7db8d8739e2897e68a2e5a0",
    "derived_event_ids": [
      "00000000-0000-7000-8000-00000000044c"
    ],
    "format_version": 1,
    "kind_version": 1,
    "lane_id": "00000000-0000-7000-8000-000000000002",
    "payload_digest": "7698736e238bbf604b19211f57f21c63c5503354ad9b4ef31e754b6a9c969f09",
    "record_id": "00000000-0000-7000-8000-000000000078",
    "run_id": "00000000-0000-7000-8000-000000000003",
    "sequence": 20,
    "session_id": "00000000-0000-7000-8000-000000000001",
    "timestamp": "1970-01-01T00:00:00.000Z"
  },
  "expect": {
    "ok": true
  },
  "format_version": 1,
  "payload_digest": "7698736e238bbf604b19211f57f21c63c5503354ad9b4ef31e754b6a9c969f09",
  "subject": "envelope"
}
