{
  "case": "interaction_cancelled",
  "cbor_hex": "ac64626f6479a175696e746572616374696f6e5f63616e63656c6c6564a16e696e746572616374696f6e5f6964782430303030303030302d303030302d373030302d383030302d3030303030303030303032396672756e5f6964782430303030303030302d303030302d373030302d383030302d303030303030303030303033676c616e655f6964782430303030303030302d303030302d373030302d383030302d30303030303030303030303268636865636b73756d7840373661386538636437613333613630343937653831373761353462623265346235303932656662313737663364333665643336343462613435316338323031356873657175656e636512697265636f72645f6964782430303030303030302d303030302d373030302d383030302d3030303030303030303037366974696d657374616d70006a73657373696f6e5f6964782430303030303030302d303030302d373030302d383030302d3030303030303030303030316c6b696e645f76657273696f6e016e666f726d61745f76657273696f6e016e7061796c6f61645f64696765737478406530303138666538393264393364316266623262306463346533366333326262653966643336306531633566396366326162313465363731363130666439356271646572697665645f6576656e745f69647381782430303030303030302d303030302d373030302d383030302d303030303030303030343338",
  "checksum": "76a8e8cd7a33a60497e8177a54bb2e4b5092efb177f3d36ed3644ba451c82015",
  "diagnostic_json": {
    "body": {
      "interaction_cancelled": {
        "interaction_id": "00000000-0000-7000-8000-000000000029"
      }
    },
    "checksum": "76a8e8cd7a33a60497e8177a54bb2e4b5092efb177f3d36ed3644ba451c82015",
    "derived_event_ids": [
      "00000000-0000-7000-8000-000000000438"
    ],
    "format_version": 1,
    "kind_version": 1,
    "lane_id": "00000000-0000-7000-8000-000000000002",
    "payload_digest": "e0018fe892d93d1bfb2b0dc4e36c32bbe9fd360e1c5f9cf2ab14e671610fd95b",
    "record_id": "00000000-0000-7000-8000-000000000076",
    "run_id": "00000000-0000-7000-8000-000000000003",
    "sequence": 18,
    "session_id": "00000000-0000-7000-8000-000000000001",
    "timestamp": "1970-01-01T00:00:00.000Z"
  },
  "expect": {
    "ok": true
  },
  "format_version": 1,
  "payload_digest": "e0018fe892d93d1bfb2b0dc4e36c32bbe9fd360e1c5f9cf2ab14e671610fd95b",
  "subject": "envelope"
}
