{
  "case": "cancellation_reconciled",
  "cbor_hex": "ac64626f6479a17763616e63656c6c6174696f6e5f7265636f6e63696c6564a46a726571756573745f6964782430303030303030302d303030302d373030302d383030302d3030303030303030303033327163616e63656c6c65645f656666656374738071636f6d706c657465645f656666656374738071756e6365727461696e5f65666665637473806672756e5f6964782430303030303030302d303030302d373030302d383030302d303030303030303030303033676c616e655f6964782430303030303030302d303030302d373030302d383030302d30303030303030303030303268636865636b73756d7840383738323138383931316662613161383334313662353132383365353663363764376433346462653461636639326439636433653234396532356563643636396873657175656e636505697265636f72645f6964782430303030303030302d303030302d373030302d383030302d3030303030303030303036396974696d657374616d70006a73657373696f6e5f6964782430303030303030302d303030302d373030302d383030302d3030303030303030303030316c6b696e645f76657273696f6e016e666f726d61745f76657273696f6e016e7061796c6f61645f64696765737478406265636164643137373165303531303532363230633962653362623937326135653639626562393839623232393331303431346363663234393463383937666571646572697665645f6576656e745f69647380",
  "checksum": "8782188911fba1a83416b51283e56c67d7d34dbe4acf92d9cd3e249e25ecd669",
  "diagnostic_json": {
    "body": {
      "cancellation_reconciled": {
        "cancelled_effects": [],
        "completed_effects": [],
        "request_id": "00000000-0000-7000-8000-000000000032",
        "uncertain_effects": []
      }
    },
    "checksum": "8782188911fba1a83416b51283e56c67d7d34dbe4acf92d9cd3e249e25ecd669",
    "derived_event_ids": [],
    "format_version": 1,
    "kind_version": 1,
    "lane_id": "00000000-0000-7000-8000-000000000002",
    "payload_digest": "becadd1771e051052620c9be3bb972a5e69beb989b229310414ccf2494c897fe",
    "record_id": "00000000-0000-7000-8000-000000000069",
    "run_id": "00000000-0000-7000-8000-000000000003",
    "sequence": 5,
    "session_id": "00000000-0000-7000-8000-000000000001",
    "timestamp": "1970-01-01T00:00:00.000Z"
  },
  "expect": {
    "ok": true
  },
  "format_version": 1,
  "payload_digest": "becadd1771e051052620c9be3bb972a5e69beb989b229310414ccf2494c897fe",
  "subject": "envelope"
}
