{
  "case": "run_accepted",
  "cbor_hex": "ac64626f6479a16c72756e5f6163636570746564a6666c696d697473a06672756e5f6964782430303030303030302d303030302d373030302d383030302d3030303030303030303030336872656c6174696f6ea3646b696e6464726f6f74656465707468006b726f6f745f72756e5f6964782430303030303030302d303030302d373030302d383030302d303030303030303030303033687365637572697479a6697072696e636970616ca36669737375657263697373677375626a656374637375626c74656e616e745f73636f70656874656e616e742d616c74656e616e745f73636f70656874656e616e742d616f6173737572616e63655f6c6576656c64686967687561757468656e7469636174696f6e5f6d6574686f64646f6964637819617574686f72697a6174696f6e5f6465636973696f6e5f69646a6465636973696f6e2d31781c617574686f72697a6174696f6e5f706f6c6963795f76657273696f6e68706f6c6963792d316b70726f7061676174696f6ea4666275646765746c7368617265645f73636f706568646561646c696e65781b6d696e696d756d5f6f665f706172656e745f616e645f6368696c64697072696e636970616c67696e68657269746c63616e63656c6c6174696f6e6763617363616465781a7265736f6c7665645f6167656e745f6c6f636b5f6469676573747840666663616230376665356431363162303663623762316266636532353137633635326635336165346234383232623863303164323531313662363234383363656672756e5f6964782430303030303030302d303030302d373030302d383030302d303030303030303030303033676c616e655f6964782430303030303030302d303030302d373030302d383030302d30303030303030303030303268636865636b73756d7840323834393763663666376664346562393136376330613230613030333930623530656230386462623332636164303638356235626539613830636337666562666873657175656e6365181c697265636f72645f6964782430303030303030302d303030302d373030302d383030302d3030303030303030303038306974696d657374616d70006a73657373696f6e5f6964782430303030303030302d303030302d373030302d383030302d3030303030303030303030316c6b696e645f76657273696f6e016e666f726d61745f76657273696f6e016e7061796c6f61645f64696765737478403664623764333238343830623339313061383661323237653830336466303166323032643134383430323535636534666564383436646561663237633931613171646572697665645f6576656e745f69647381782430303030303030302d303030302d373030302d383030302d303030303030303030343963",
  "checksum": "28497cf6f7fd4eb9167c0a20a00390b50eb08dbb32cad0685b5be9a80cc7febf",
  "diagnostic_json": {
    "body": {
      "run_accepted": {
        "limits": {},
        "propagation": {
          "budget": "shared_scope",
          "cancellation": "cascade",
          "deadline": "minimum_of_parent_and_child",
          "principal": "inherit"
        },
        "relation": {
          "depth": 0,
          "kind": "root",
          "root_run_id": "00000000-0000-7000-8000-000000000003"
        },
        "resolved_agent_lock_digest": "ffcab07fe5d161b06cb7b1bfce2517c652f53ae4b4822b8c01d25116b62483ce",
        "run_id": "00000000-0000-7000-8000-000000000003",
        "security": {
          "assurance_level": "high",
          "authentication_method": "oidc",
          "authorization_decision_id": "decision-1",
          "authorization_policy_version": "policy-1",
          "principal": {
            "issuer": "iss",
            "subject": "sub",
            "tenant_scope": "tenant-a"
          },
          "tenant_scope": "tenant-a"
        }
      }
    },
    "checksum": "28497cf6f7fd4eb9167c0a20a00390b50eb08dbb32cad0685b5be9a80cc7febf",
    "derived_event_ids": [
      "00000000-0000-7000-8000-00000000049c"
    ],
    "format_version": 1,
    "kind_version": 1,
    "lane_id": "00000000-0000-7000-8000-000000000002",
    "payload_digest": "6db7d328480b3910a86a227e803df01f202d14840255ce4fed846deaf27c91a1",
    "record_id": "00000000-0000-7000-8000-000000000080",
    "run_id": "00000000-0000-7000-8000-000000000003",
    "sequence": 28,
    "session_id": "00000000-0000-7000-8000-000000000001",
    "timestamp": "1970-01-01T00:00:00.000Z"
  },
  "expect": {
    "ok": true
  },
  "format_version": 1,
  "payload_digest": "6db7d328480b3910a86a227e803df01f202d14840255ce4fed846deaf27c91a1",
  "subject": "envelope"
}
