{
  "case": "limit_reached",
  "cbor_hex": "ac64626f6479a16d6c696d69745f72656163686564a5657573616765aa657475726e73006772657472696573006977616c6c5f74696d65006a746f6f6c5f63616c6c73006c696e7075745f746f6b656e73006c6f75747075745f6279746573006d636f6e746578745f6279746573006d6f75747075745f746f6b656e73006e6d6f64656c5f726571756573747302726d61785f706172616c6c656c5f746f6f6c7300676d6178696d756da165636f756e7401686f62736572766564a165636f756e74026964696d656e73696f6ea1646b696e646e6d6f64656c5f72657175657374736c75736167655f6469676573747840393039393866386366383535663034303630393965323165373631316438343837363833306232343631323637353131646137616465386436353937333138646672756e5f6964782430303030303030302d303030302d373030302d383030302d303030303030303030303033676c616e655f6964782430303030303030302d303030302d373030302d383030302d30303030303030303030303268636865636b73756d7840306261333339636330336263353765353664396466653132303634383361623364333665643634363662373039373131343835346363666634373432346566336873657175656e63651818697265636f72645f6964782430303030303030302d303030302d373030302d383030302d3030303030303030303037636974696d657374616d70006a73657373696f6e5f6964782430303030303030302d303030302d373030302d383030302d3030303030303030303030316c6b696e645f76657273696f6e016e666f726d61745f76657273696f6e016e7061796c6f61645f64696765737478403463623934313065363935323864323065303365343864393237336230323462616330656639343065376331303838313837303730616134623861633465326171646572697665645f6576656e745f69647381782430303030303030302d303030302d373030302d383030302d303030303030303030343734",
  "checksum": "0ba339cc03bc57e56d9dfe1206483ab3d36ed6466b7097114854ccff47424ef3",
  "diagnostic_json": {
    "body": {
      "limit_reached": {
        "dimension": {
          "kind": "model_requests"
        },
        "maximum": {
          "count": 1
        },
        "observed": {
          "count": 2
        },
        "usage": {
          "context_bytes": 0,
          "input_tokens": 0,
          "max_parallel_tools": 0,
          "model_requests": 2,
          "output_bytes": 0,
          "output_tokens": 0,
          "retries": 0,
          "tool_calls": 0,
          "turns": 0,
          "wall_time": 0
        },
        "usage_digest": "90998f8cf855f0406099e21e7611d84876830b2461267511da7ade8d6597318d"
      }
    },
    "checksum": "0ba339cc03bc57e56d9dfe1206483ab3d36ed6466b7097114854ccff47424ef3",
    "derived_event_ids": [
      "00000000-0000-7000-8000-000000000474"
    ],
    "format_version": 1,
    "kind_version": 1,
    "lane_id": "00000000-0000-7000-8000-000000000002",
    "payload_digest": "4cb9410e69528d20e03e48d9273b024bac0ef940e7c1088187070aa4b8ac4e2a",
    "record_id": "00000000-0000-7000-8000-00000000007c",
    "run_id": "00000000-0000-7000-8000-000000000003",
    "sequence": 24,
    "session_id": "00000000-0000-7000-8000-000000000001",
    "timestamp": "1970-01-01T00:00:00.000Z"
  },
  "expect": {
    "ok": true
  },
  "format_version": 1,
  "payload_digest": "4cb9410e69528d20e03e48d9273b024bac0ef940e7c1088187070aa4b8ac4e2a",
  "subject": "envelope"
}
