{
  "case": "tool_call_settled",
  "cbor_hex": "ac64626f6479a171746f6f6c5f63616c6c5f736574746c6564a9656379636c6500656572726f72a664636f64656c756e6b6e6f776e5f746f6f6c676d6573736167656c756e6b6e6f776e20746f6f6c6863617465676f727964746f6f6c69726574727961626c65f46b6964656e74696669657273a06c736166655f64657461696c73427b7d676d657373616765a6626964782430313233343536372d383961622d376364652d383961622d30313233343536373839333164726f6c6564746f6f6c67636f6e74656e7481a4646b696e646b746f6f6c5f726573756c7467636f6e74656e7481a2646b696e64647465787464746578746c756e6b6e6f776e20746f6f6c6869735f6572726f72f56c746f6f6c5f63616c6c5f6964782430313233343536372d383961622d376364652d383961622d303132333435363738393239686d65746164617461427b7d6a637265617465645f617419044c6c70726f76696465725f696473a0677475726e5f6964782430313233343536372d383961622d376364652d383961622d303132333435363738393237696566666563745f6964782430313233343536372d383961622d376364652d383961622d3031323334353637383933306973796e746865746963f56c746f6f6c5f63616c6c5f6964782430313233343536372d383961622d376364652d383961622d3031323334353637383932396d746f6f6c5f62617463685f6964782430313233343536372d383961622d376364652d383961622d30313233343536373839323871736574746c656d656e745f6469676573747840333333333333333333333333333333333333333333333333333333333333333333333333333333333333333333333333333333333333333333333333333333336672756e5f6964782430303030303030302d303030302d373030302d383030302d303030303030303030303033676c616e655f6964782430303030303030302d303030302d373030302d383030302d30303030303030303030303268636865636b73756d7840663337323234323663353332343134663735366639633364636262343733333835323736303561633635333962633831356166633939356638653330376330616873657175656e63651827697265636f72645f6964782430303030303030302d303030302d373030302d383030302d3030303030303030303038626974696d657374616d70006a73657373696f6e5f6964782430303030303030302d303030302d373030302d383030302d3030303030303030303030316c6b696e645f76657273696f6e016e666f726d61745f76657273696f6e016e7061796c6f61645f64696765737478406131643365386262353464326364626130653163633439633438356664373335343032333432396436376437353932343835353966633530613366386530643171646572697665645f6576656e745f69647382782430303030303030302d303030302d373030302d383030302d303030303030303030353061782430303030303030302d303030302d373030302d383030302d303030303030303030353062",
  "checksum": "f3722426c532414f756f9c3dcbb47338527605ac6539bc815afc995f8e307c0a",
  "diagnostic_json": {
    "body": {
      "tool_call_settled": {
        "cycle": 0,
        "effect_id": "01234567-89ab-7cde-89ab-012345678930",
        "error": {
          "category": "tool",
          "code": "unknown_tool",
          "identifiers": {},
          "message": "unknown tool",
          "retryable": false,
          "safe_details": {}
        },
        "message": {
          "content": [
            {
              "content": [
                {
                  "kind": "text",
                  "text": "unknown tool"
                }
              ],
              "is_error": true,
              "kind": "tool_result",
              "tool_call_id": "01234567-89ab-7cde-89ab-012345678929"
            }
          ],
          "created_at": "1970-01-01T00:00:01.100Z",
          "id": "01234567-89ab-7cde-89ab-012345678931",
          "metadata": {},
          "provider_ids": {},
          "role": "tool"
        },
        "settlement_digest": "3333333333333333333333333333333333333333333333333333333333333333",
        "synthetic": true,
        "tool_batch_id": "01234567-89ab-7cde-89ab-012345678928",
        "tool_call_id": "01234567-89ab-7cde-89ab-012345678929",
        "turn_id": "01234567-89ab-7cde-89ab-012345678927"
      }
    },
    "checksum": "f3722426c532414f756f9c3dcbb47338527605ac6539bc815afc995f8e307c0a",
    "derived_event_ids": [
      "00000000-0000-7000-8000-00000000050a",
      "00000000-0000-7000-8000-00000000050b"
    ],
    "format_version": 1,
    "kind_version": 1,
    "lane_id": "00000000-0000-7000-8000-000000000002",
    "payload_digest": "a1d3e8bb54d2cdba0e1cc49c485fd7354023429d67d759248559fc50a3f8e0d1",
    "record_id": "00000000-0000-7000-8000-00000000008b",
    "run_id": "00000000-0000-7000-8000-000000000003",
    "sequence": 39,
    "session_id": "00000000-0000-7000-8000-000000000001",
    "timestamp": "1970-01-01T00:00:00.000Z"
  },
  "expect": {
    "ok": true
  },
  "format_version": 1,
  "payload_digest": "a1d3e8bb54d2cdba0e1cc49c485fd7354023429d67d759248559fc50a3f8e0d1",
  "subject": "envelope"
}
