{
  "case": "lane_moved",
  "cbor_hex": "ab64626f6479a16a6c616e655f6d6f766564a1676c6561665f6964782430303030303030302d303030302d373030302d383030302d303030303030303030303530676c616e655f6964782430303030303030302d303030302d373030302d383030302d30303030303030303030303268636865636b73756d7840396366613163313039323936336134333663363334623335633664616339346663316262633430643834366638383363346131383139666137386338353961336873657175656e636517697265636f72645f6964782430303030303030302d303030302d373030302d383030302d3030303030303030303037626974696d657374616d70006a73657373696f6e5f6964782430303030303030302d303030302d373030302d383030302d3030303030303030303030316c6b696e645f76657273696f6e016e666f726d61745f76657273696f6e016e7061796c6f61645f64696765737478403133636239396165373434353062303037323138633530316561396338626132613535366639623135633463373134313339656565396634373766306335303571646572697665645f6576656e745f69647380",
  "checksum": "9cfa1c1092963a436c634b35c6dac94fc1bbc40d846f883c4a1819fa78c859a3",
  "diagnostic_json": {
    "body": {
      "lane_moved": {
        "leaf_id": "00000000-0000-7000-8000-000000000050"
      }
    },
    "checksum": "9cfa1c1092963a436c634b35c6dac94fc1bbc40d846f883c4a1819fa78c859a3",
    "derived_event_ids": [],
    "format_version": 1,
    "kind_version": 1,
    "lane_id": "00000000-0000-7000-8000-000000000002",
    "payload_digest": "13cb99ae74450b007218c501ea9c8ba2a556f9b15c4c714139eee9f477f0c505",
    "record_id": "00000000-0000-7000-8000-00000000007b",
    "sequence": 23,
    "session_id": "00000000-0000-7000-8000-000000000001",
    "timestamp": "1970-01-01T00:00:00.000Z"
  },
  "expect": {
    "ok": true
  },
  "format_version": 1,
  "payload_digest": "13cb99ae74450b007218c501ea9c8ba2a556f9b15c4c714139eee9f477f0c505",
  "subject": "envelope"
}
