{
  "case": "conversation_entry",
  "cbor_hex": "ab64626f6479a172636f6e766572736174696f6e5f656e747279a4626964782430303030303030302d303030302d373030302d383030302d30303030303030303030356164626f6479a1676d657373616765a6626964782430303030303030302d303030302d373030302d383030302d30303030303030303030356164726f6c65647573657267636f6e74656e7481a2646b696e64647465787464746578746568656c6c6f686d65746164617461427b7d6a637265617465645f6174006c70726f76696465725f696473a0676c616e655f6964782430303030303030302d303030302d373030302d383030302d3030303030303030303030326873657175656e636501676c616e655f6964782430303030303030302d303030302d373030302d383030302d30303030303030303030303268636865636b73756d7840336663393962386437316537376432613236376265613535366536393966356463363830383065383231386635383362383531396230663464343533336633656873657175656e63650a697265636f72645f6964782430303030303030302d303030302d373030302d383030302d3030303030303030303036656974696d657374616d70006a73657373696f6e5f6964782430303030303030302d303030302d373030302d383030302d3030303030303030303030316c6b696e645f76657273696f6e016e666f726d61745f76657273696f6e016e7061796c6f61645f64696765737478403864383764646332313666633065626230313836633164623661393335396362626666646334646638633032373134353163343230633363646130383937343071646572697665645f6576656e745f69647380",
  "checksum": "3fc99b8d71e77d2a267bea556e699f5dc68080e8218f583b8519b0f4d4533f3e",
  "diagnostic_json": {
    "body": {
      "conversation_entry": {
        "body": {
          "message": {
            "content": [
              {
                "kind": "text",
                "text": "hello"
              }
            ],
            "created_at": "1970-01-01T00:00:00.000Z",
            "id": "00000000-0000-7000-8000-00000000005a",
            "metadata": {},
            "provider_ids": {},
            "role": "user"
          }
        },
        "id": "00000000-0000-7000-8000-00000000005a",
        "lane_id": "00000000-0000-7000-8000-000000000002",
        "sequence": 1
      }
    },
    "checksum": "3fc99b8d71e77d2a267bea556e699f5dc68080e8218f583b8519b0f4d4533f3e",
    "derived_event_ids": [],
    "format_version": 1,
    "kind_version": 1,
    "lane_id": "00000000-0000-7000-8000-000000000002",
    "payload_digest": "8d87ddc216fc0ebb0186c1db6a9359cbbffdc4df8c0271451c420c3cda089740",
    "record_id": "00000000-0000-7000-8000-00000000006e",
    "sequence": 10,
    "session_id": "00000000-0000-7000-8000-000000000001",
    "timestamp": "1970-01-01T00:00:00.000Z"
  },
  "expect": {
    "ok": true
  },
  "format_version": 1,
  "payload_digest": "8d87ddc216fc0ebb0186c1db6a9359cbbffdc4df8c0271451c420c3cda089740",
  "subject": "envelope"
}
