{
  "case": "effect_requested",
  "cbor_hex": "a1706566666563745f726571756573746564a6646b696e64656d6f64656c65696e707574a1656d6f64656ca167726571756573744f7b226d65737361676573223a5b5d7d696566666563745f6964782430303030303030302d303030302d373030302d383030302d3030303030303030303030616c696e7075745f6469676573747840393937646236663631616464343339356532643331653931626635303664363961333736653266323333353833366165346130393564663366366333393634306c72657472795f7361666574796d736166655f746f5f72657472796f6f75747075745f636f6e7472616374a3646b696e646e6d6f64656c5f726573706f6e73656d736368656d615f6469676573747840666663616230376665356431363162303663623762316266636532353137633635326635336165346234383232623863303164323531313662363234383363656e736368656d615f76657273696f6e01",
  "diagnostic_json": {
    "effect_requested": {
      "effect_id": "00000000-0000-7000-8000-00000000000a",
      "input": {
        "model": {
          "request": {
            "messages": []
          }
        }
      },
      "input_digest": "997db6f61add4395e2d31e91bf506d69a376e2f2335836ae4a095df3f6c39640",
      "kind": "model",
      "output_contract": {
        "kind": "model_response",
        "schema_digest": "ffcab07fe5d161b06cb7b1bfce2517c652f53ae4b4822b8c01d25116b62483ce",
        "schema_version": 1
      },
      "retry_safety": "safe_to_retry"
    }
  },
  "expect": {
    "ok": true
  },
  "format_version": 1,
  "payload_digest": "6c2cdd4550f5864b6480b8c879e55a1700af5ee5e4b8633a041385448eab39eb",
  "subject": "record-payload"
}
