{
  "case": "entry_appended",
  "cbor_hex": "a16e656e7472795f617070656e646564a5656379636c6500676d657373616765a6626964782430313233343536372d383961622d376364652d383961622d30313233343536373839613964726f6c6569617373697374616e7467636f6e74656e7481a2646b696e64647465787464746578746568656c6c6f686d65746164617461427b7d6a637265617465645f61741903e86c70726f76696465725f696473a0677475726e5f6964782430313233343536372d383961622d376364652d383961622d303132333435363738396136696566666563745f6964782430313233343536372d383961622d376364652d383961622d303132333435363738396138706d6f64656c5f726571756573745f6964782430313233343536372d383961622d376364652d383961622d303132333435363738396137",
  "diagnostic_json": {
    "entry_appended": {
      "cycle": 0,
      "effect_id": "01234567-89ab-7cde-89ab-0123456789a8",
      "message": {
        "content": [
          {
            "kind": "text",
            "text": "hello"
          }
        ],
        "created_at": "1970-01-01T00:00:01.000Z",
        "id": "01234567-89ab-7cde-89ab-0123456789a9",
        "metadata": {},
        "provider_ids": {},
        "role": "assistant"
      },
      "model_request_id": "01234567-89ab-7cde-89ab-0123456789a7",
      "turn_id": "01234567-89ab-7cde-89ab-0123456789a6"
    }
  },
  "expect": {
    "ok": true
  },
  "format_version": 1,
  "payload_digest": "792678710d21cecb25df5ffcb2683d6cc236987ae72b9aba93115a2d56cf3875",
  "subject": "record-payload"
}
