{
  "case": "capabilities_activated",
  "cbor_hex": "a1766361706162696c69746965735f616374697661746564a26661637469766581a266736f7572636566616c776179736d6361706162696c6974795f6964781966696e737461636b2e6361706162696c6974792e616c706861747265736f6c7665645f706c616e5f646967657374784032323232323232323232323232323232323232323232323232323232323232323232323232323232323232323232323232323232323232323232323232323232",
  "diagnostic_json": {
    "capabilities_activated": {
      "active": [
        {
          "capability_id": "finstack.capability.alpha",
          "source": "always"
        }
      ],
      "resolved_plan_digest": "2222222222222222222222222222222222222222222222222222222222222222"
    }
  },
  "expect": {
    "ok": true
  },
  "format_version": 1,
  "payload_digest": "f5748b738fa098c095d4ebec57bd81c2343b454d2d7c6950c7c1b20d1c7eafbf",
  "subject": "record-payload"
}
