{
  "case": "context_prepared",
  "cbor_hex": "ac64626f6479a170636f6e746578745f7072657061726564a4656379636c6500677475726e5f6964782430303030303030302d303030302d373030302d383030302d303030303030303030303165686d65737361676573806e636f6e746578745f6469676573747840646338376333393231386235313662333035623835386563313161316232303134666539613731343935353936393231613264356234373763396561323264666672756e5f6964782430303030303030302d303030302d373030302d383030302d303030303030303030303033676c616e655f6964782430303030303030302d303030302d373030302d383030302d30303030303030303030303268636865636b73756d7840363539643534636463356666383765326164633464363466616164383632633866623531663834343235326432333464326135366662393663376239656137616873657175656e636509697265636f72645f6964782430303030303030302d303030302d373030302d383030302d3030303030303030303036646974696d657374616d70006a73657373696f6e5f6964782430303030303030302d303030302d373030302d383030302d3030303030303030303030316c6b696e645f76657273696f6e016e666f726d61745f76657273696f6e016e7061796c6f61645f64696765737478403839363434613266356232653434303561383239366131633661613136636533356536383330623836313432356334383562636663636133363530343664333271646572697665645f6576656e745f69647380",
  "checksum": "659d54cdc5ff87e2adc4d64faad862c8fb51f844252d234d2a56fb96c7b9ea7a",
  "diagnostic_json": {
    "body": {
      "context_prepared": {
        "context_digest": "dc87c39218b516b305b858ec11a1b2014fe9a71495596921a2d5b477c9ea22df",
        "cycle": 0,
        "messages": [],
        "turn_id": "00000000-0000-7000-8000-00000000001e"
      }
    },
    "checksum": "659d54cdc5ff87e2adc4d64faad862c8fb51f844252d234d2a56fb96c7b9ea7a",
    "derived_event_ids": [],
    "format_version": 1,
    "kind_version": 1,
    "lane_id": "00000000-0000-7000-8000-000000000002",
    "payload_digest": "89644a2f5b2e4405a8296a1c6aa16ce35e6830b861425c485bcfcca365046d32",
    "record_id": "00000000-0000-7000-8000-00000000006d",
    "run_id": "00000000-0000-7000-8000-000000000003",
    "sequence": 9,
    "session_id": "00000000-0000-7000-8000-000000000001",
    "timestamp": "1970-01-01T00:00:00.000Z"
  },
  "expect": {
    "ok": true
  },
  "format_version": 1,
  "payload_digest": "89644a2f5b2e4405a8296a1c6aa16ce35e6830b861425c485bcfcca365046d32",
  "subject": "envelope"
}
