{
  "case": "interaction_requested",
  "cbor_hex": "a175696e746572616374696f6e5f726571756573746564ac646b696e64a1646b696e6468617070726f76616c6670726f6d707480686d65746164617461427b7d696566666563745f6964782430303030303030302d303030302d373030302d383030302d3030303030303030303031356b64656c6567617461626c65f46d70726f6d70745f6469676573747840363130356131323439353832386165343132383161306466613834373733356165643532393838333630333463393331383232343439363432316461396663316e696e746572616374696f6e5f6964782430303030303030302d303030302d373030302d383030302d3030303030303030303031346e706f6c6963795f76657273696f6ea3656d616a6f7201656d696e6f7200657061746368006f726571756573745f76657273696f6e016f726573706f6e73655f736368656d61527b2274797065223a22626f6f6c65616e227d70706f6c6963795f636f6d706f6e656e74a2626964781866696e737461636b2e706f6c6963792e617070726f76616c6776657273696f6ea3656d616a6f7201656d696e6f72006570617463680076726573706f6e73655f736368656d615f646967657374784034393134643064366132663336643337316661326532353461373736653064303639333637643738333537363037333339386335326135613433656232353966",
  "diagnostic_json": {
    "interaction_requested": {
      "delegatable": false,
      "effect_id": "00000000-0000-7000-8000-000000000015",
      "interaction_id": "00000000-0000-7000-8000-000000000014",
      "kind": {
        "kind": "approval"
      },
      "metadata": {},
      "policy_component": {
        "id": "finstack.policy.approval",
        "version": {
          "major": 1,
          "minor": 0,
          "patch": 0
        }
      },
      "policy_version": {
        "major": 1,
        "minor": 0,
        "patch": 0
      },
      "prompt": [],
      "prompt_digest": "6105a12495828ae41281a0dfa847735aed5298836034c9318224496421da9fc1",
      "request_version": 1,
      "response_schema": {
        "type": "boolean"
      },
      "response_schema_digest": "4914d0d6a2f36d371fa2e254a776e0d069367d783576073398c52a5a43eb259f"
    }
  },
  "expect": {
    "ok": true
  },
  "format_version": 1,
  "payload_digest": "7698736e238bbf604b19211f57f21c63c5503354ad9b4ef31e754b6a9c969f09",
  "subject": "record-payload"
}
