{
  "case": "run_completed",
  "cbor_hex": "ac64626f6479a16d72756e5f636f6d706c65746564a6656379636c6500677475726e5f6964782430303030303030302d303030302d373030302d383030302d303030303030303030303436696566666563745f6964782430303030303030302d303030302d373030302d383030302d3030303030303030303034386d726573756c745f646967657374784066666361623037666535643136316230366362376231626663653235313763363532663533616534623438323262386330316432353131366236323438336365706d6f64656c5f726571756573745f6964782430303030303030302d303030302d373030302d383030302d30303030303030303030343771726573756c745f6d6573736167655f6964782430303030303030302d303030302d373030302d383030302d3030303030303030303034396672756e5f6964782430303030303030302d303030302d373030302d383030302d303030303030303030303033676c616e655f6964782430303030303030302d303030302d373030302d383030302d30303030303030303030303268636865636b73756d7840333665396533323236346264643865653936323531363238393335663539626661613364616166383132613031353561643439393737666665666464353632336873657175656e6365181e697265636f72645f6964782430303030303030302d303030302d373030302d383030302d3030303030303030303038326974696d657374616d70006a73657373696f6e5f6964782430303030303030302d303030302d373030302d383030302d3030303030303030303030316c6b696e645f76657273696f6e016e666f726d61745f76657273696f6e016e7061796c6f61645f64696765737478403130323333376538656163623938353961396464333539376131313433623633363865363139343766616334343539633933623230363666623965333439633271646572697665645f6576656e745f69647381782430303030303030302d303030302d373030302d383030302d303030303030303030346230",
  "checksum": "36e9e32264bdd8ee96251628935f59bfaa3daaf812a0155ad49977ffefdd5623",
  "diagnostic_json": {
    "body": {
      "run_completed": {
        "cycle": 0,
        "effect_id": "00000000-0000-7000-8000-000000000048",
        "model_request_id": "00000000-0000-7000-8000-000000000047",
        "result_digest": "ffcab07fe5d161b06cb7b1bfce2517c652f53ae4b4822b8c01d25116b62483ce",
        "result_message_id": "00000000-0000-7000-8000-000000000049",
        "turn_id": "00000000-0000-7000-8000-000000000046"
      }
    },
    "checksum": "36e9e32264bdd8ee96251628935f59bfaa3daaf812a0155ad49977ffefdd5623",
    "derived_event_ids": [
      "00000000-0000-7000-8000-0000000004b0"
    ],
    "format_version": 1,
    "kind_version": 1,
    "lane_id": "00000000-0000-7000-8000-000000000002",
    "payload_digest": "102337e8eacb9859a9dd3597a1143b6368e61947fac4459c93b2066fb9e349c2",
    "record_id": "00000000-0000-7000-8000-000000000082",
    "run_id": "00000000-0000-7000-8000-000000000003",
    "sequence": 30,
    "session_id": "00000000-0000-7000-8000-000000000001",
    "timestamp": "1970-01-01T00:00:00.000Z"
  },
  "expect": {
    "ok": true
  },
  "format_version": 1,
  "payload_digest": "102337e8eacb9859a9dd3597a1143b6368e61947fac4459c93b2066fb9e349c2",
  "subject": "envelope"
}
